[
	{
		"index": 0,
		"title": "Gmail",
		"url": "https://accounts.google.com/b/0/AddMailService",
		"id": 8,
		"parentId": "1",
		"dateAddedLocal": "18/09/2022, 12:52:45",
		"dateAddedUTC": "2022-09-18T07:22:45.225Z"
	},
	{
		"index": 1,
		"title": "YouTube",
		"url": "https://youtube.com/",
		"id": 9,
		"parentId": "1",
		"dateAddedLocal": "18/09/2022, 12:52:45",
		"dateAddedUTC": "2022-09-18T07:22:45.227Z"
	},
	{
		"index": 2,
		"title": "Maps",
		"url": "https://maps.google.com/",
		"id": 10,
		"parentId": "1",
		"dateAddedLocal": "18/09/2022, 12:52:45",
		"dateAddedUTC": "2022-09-18T07:22:45.227Z"
	},
	{
		"index": 3,
		"title": "Translate",
		"url": "https://translate.google.com/",
		"id": 11,
		"parentId": "1",
		"dateAddedLocal": "23/02/2020, 01:57:25",
		"dateAddedUTC": "2020-02-22T20:27:25.669Z"
	},
	{
		"index": 4,
		"title": "Admin, person, user, man Free Icon of Free Large Boss",
		"url": "https://icon-icons.com/icon/admin-person-user-man/2284",
		"id": 12,
		"parentId": "1",
		"dateAddedLocal": "29/02/2020, 21:36:00",
		"dateAddedUTC": "2020-02-29T16:06:00.214Z"
	},
	{
		"index": 5,
		"title": "Django Deployment - Digital Ocean",
		"url": "https://gist.github.com/bradtraversy/cfa565b879ff1458dba08f423cb01d71",
		"id": 13,
		"parentId": "1",
		"dateAddedLocal": "18/03/2020, 23:54:56",
		"dateAddedUTC": "2020-03-18T18:24:56.576Z"
	},
	{
		"index": 6,
		"title": "Geoff Thomas - Software Engineer",
		"url": "http://www.thomasgeoff.com/",
		"id": 14,
		"parentId": "1",
		"dateAddedLocal": "20/03/2020, 02:21:44",
		"dateAddedUTC": "2020-03-19T20:51:44.933Z"
	},
	{
		"index": 7,
		"title": "The best SaaS landing page examples for design inspiration - SaaS Landing Page",
		"url": "https://saaslandingpage.com/",
		"id": 15,
		"parentId": "1",
		"dateAddedLocal": "06/04/2020, 01:56:48",
		"dateAddedUTC": "2020-04-05T20:26:48.177Z"
	},
	{
		"index": 8,
		"title": "Eduardo Ochs (a.k.a. Edrx) - Personal Stuff",
		"url": "http://angg.twu.net/tmp-b.html",
		"id": 16,
		"parentId": "1",
		"dateAddedLocal": "15/04/2020, 09:45:55",
		"dateAddedUTC": "2020-04-15T04:15:55.970Z"
	},
	{
		"index": 9,
		"title": "DEVICON | All programming languages and development tools related icons font",
		"url": "https://konpa.github.io/devicon/",
		"id": 17,
		"parentId": "1",
		"dateAddedLocal": "16/04/2020, 02:03:01",
		"dateAddedUTC": "2020-04-15T20:33:01.695Z"
	},
	{
		"index": 10,
		"title": "Friends – JetBrains Academy",
		"url": "https://hyperskill.org/friends",
		"id": 18,
		"parentId": "1",
		"dateAddedLocal": "26/07/2020, 09:28:33",
		"dateAddedUTC": "2020-07-26T03:58:33.660Z"
	},
	{
		"index": 11,
		"title": "Files of coursedownloader",
		"url": "https://uploadcenter.com/users/coursedownloader",
		"id": 19,
		"parentId": "1",
		"dateAddedLocal": "13/09/2020, 21:30:22",
		"dateAddedUTC": "2020-09-13T16:00:22.308Z"
	},
	{
		"index": 12,
		"title": "Topic wise multiple choice questions in computer science",
		"url": "https://www.geeksforgeeks.org/quiz-corner-gq/",
		"id": 20,
		"parentId": "1",
		"dateAddedLocal": "09/11/2020, 14:28:29",
		"dateAddedUTC": "2020-11-09T08:58:29.107Z"
	},
	{
		"index": 13,
		"title": "Green Screen Tracking Compositing Using After Effects - YouTube",
		"url": "https://www.youtube.com/watch?v=LZrCSU4TEG0",
		"id": 21,
		"parentId": "1",
		"dateAddedLocal": "12/01/2021, 03:30:56",
		"dateAddedUTC": "2021-01-11T22:00:56.755Z"
	},
	{
		"index": 14,
		"title": "Unicode to Kruti Dev यूनिकोड = कृतिदेव Converter",
		"url": "https://www.unicodetokrutidev.com/",
		"id": 22,
		"parentId": "1",
		"dateAddedLocal": "13/01/2021, 18:17:00",
		"dateAddedUTC": "2021-01-13T12:47:00.253Z"
	},
	{
		"index": 15,
		"title": "Bootstrap Glyphicons v3.3.7 | Bootstrap Cheat Sheets",
		"url": "https://glyphicons.bootstrapcheatsheets.com/#",
		"id": 23,
		"parentId": "1",
		"dateAddedLocal": "16/01/2021, 11:24:26",
		"dateAddedUTC": "2021-01-16T05:54:26.895Z"
	},
	{
		"index": 16,
		"title": "Free vector icons - SVG, PSD, PNG, EPS & Icon Font - Thousands of free icons",
		"url": "https://www.flaticon.com/",
		"id": 24,
		"parentId": "1",
		"dateAddedLocal": "22/02/2021, 18:32:10",
		"dateAddedUTC": "2021-02-22T13:02:10.180Z"
	},
	{
		"index": 17,
		"title": "TOP 5 WEBSITES EVERY WEB DESIGNER SHOULD VISIT: Mind-blowing web design | March 2020 - YouTube",
		"url": "https://www.youtube.com/watch?v=AmHEfTSBXiY",
		"id": 25,
		"parentId": "1",
		"dateAddedLocal": "27/02/2021, 15:27:18",
		"dateAddedUTC": "2021-02-27T09:57:18.993Z"
	},
	{
		"index": 18,
		"title": "iLovePDF | Online PDF tools for PDF lovers",
		"url": "https://www.ilovepdf.com/",
		"id": 26,
		"parentId": "1",
		"dateAddedLocal": "01/03/2021, 09:29:47",
		"dateAddedUTC": "2021-03-01T03:59:47.046Z"
	},
	{
		"index": 19,
		"title": "10 Code Snippets for Creating Responsive Navigation Menus",
		"url": "https://1stwebdesigner.com/code-snippets-responsive-navigation-menu/",
		"id": 27,
		"parentId": "1",
		"dateAddedLocal": "02/03/2021, 15:11:39",
		"dateAddedUTC": "2021-03-02T09:41:39.148Z"
	},
	{
		"index": 20,
		"title": "Lusion",
		"url": "https://lusion.co/contact",
		"id": 28,
		"parentId": "1",
		"dateAddedLocal": "02/03/2021, 17:42:22",
		"dateAddedUTC": "2021-03-02T12:12:22.221Z"
	},
	{
		"index": 21,
		"title": "weqsx",
		"url": "http://127.0.0.1:5500/gallery.html",
		"id": 29,
		"parentId": "1",
		"dateAddedLocal": "08/03/2021, 16:51:02",
		"dateAddedUTC": "2021-03-08T11:21:02.459Z"
	},
	{
		"index": 22,
		"title": "DesignValley | The Ultimate Design Tool",
		"url": "https://designvalley.club/",
		"id": 30,
		"parentId": "1",
		"dateAddedLocal": "09/03/2021, 16:09:23",
		"dateAddedUTC": "2021-03-09T10:39:23.452Z"
	},
	{
		"index": 23,
		"title": "justdjango/django-ecommerce: An e-commerce website built with Django",
		"url": "https://github.com/justdjango/django-ecommerce",
		"id": 31,
		"parentId": "1",
		"dateAddedLocal": "11/03/2021, 13:20:00",
		"dateAddedUTC": "2021-03-11T07:50:00.588Z"
	},
	{
		"index": 24,
		"title": "Neumorphism/Soft UI CSS shadow generator",
		"url": "https://neumorphism.io/#001f3f",
		"id": 32,
		"parentId": "1",
		"dateAddedLocal": "12/03/2021, 12:49:15",
		"dateAddedUTC": "2021-03-12T07:19:15.725Z"
	},
	{
		"index": 25,
		"title": "Glassmorphism CSS Generator",
		"url": "https://glassmorphism.com/",
		"id": 33,
		"parentId": "1",
		"dateAddedLocal": "12/03/2021, 13:03:21",
		"dateAddedUTC": "2021-03-12T07:33:21.185Z"
	},
	{
		"index": 26,
		"title": "Bootstrap Snippet Transparent Sticky NavBar using HTML CSS jQuery",
		"url": "https://bootsnipp.com/snippets/kl8Q3",
		"id": 34,
		"parentId": "1",
		"dateAddedLocal": "13/03/2021, 11:59:57",
		"dateAddedUTC": "2021-03-13T06:29:57.558Z"
	},
	{
		"index": 27,
		"title": "Best sellers for sports Template",
		"url": "https://nicepage.com/t/27240/best-sellers-for-sports-template",
		"id": 35,
		"parentId": "1",
		"dateAddedLocal": "15/03/2021, 18:36:00",
		"dateAddedUTC": "2021-03-15T13:06:00.901Z"
	},
	{
		"index": 28,
		"title": "Refuel at power gym Template",
		"url": "https://nicepage.com/t/93543/refuel-at-power-gym-template",
		"id": 36,
		"parentId": "1",
		"dateAddedLocal": "15/03/2021, 18:36:09",
		"dateAddedUTC": "2021-03-15T13:06:09.117Z"
	},
	{
		"index": 29,
		"title": "6500+ Templates | Free Templates 2021",
		"url": "https://nicepage.com/templates",
		"id": 37,
		"parentId": "1",
		"dateAddedLocal": "15/03/2021, 18:36:13",
		"dateAddedUTC": "2021-03-15T13:06:13.497Z"
	},
	{
		"index": 30,
		"title": "Free Trial – Try Microsoft 365 for a month – Microsoft Store",
		"url": "https://www.microsoft.com/en-in/microsoft-365/try?ocid=oo_support_mix_marvel_ups_support_tryfloatie&rtc=1",
		"id": 38,
		"parentId": "1",
		"dateAddedLocal": "27/03/2021, 12:51:59",
		"dateAddedUTC": "2021-03-27T07:21:59.802Z"
	},
	{
		"index": 31,
		"title": "Microsoft Office Home",
		"url": "https://www.office.com/?auth=1",
		"id": 39,
		"parentId": "1",
		"dateAddedLocal": "27/03/2021, 12:52:08",
		"dateAddedUTC": "2021-03-27T07:22:08.035Z"
	},
	{
		"index": 32,
		"title": "Five ambient webpage backgrounds created using the HTML5 Canvas API and jwagner's Simplex Noise library.",
		"url": "https://github.com/crnacura/AmbientCanvasBackgrounds",
		"id": 40,
		"parentId": "1",
		"dateAddedLocal": "13/04/2021, 02:28:21",
		"dateAddedUTC": "2021-04-12T20:58:21.685Z"
	},
	{
		"index": 33,
		"title": "flickr_gallery demo",
		"url": "https://nchelluri.neocities.org/",
		"id": 41,
		"parentId": "1",
		"dateAddedLocal": "15/04/2021, 02:00:47",
		"dateAddedUTC": "2021-04-14T20:30:47.337Z"
	},
	{
		"index": 34,
		"title": "Bootstrap Gallery - examples & tutorial",
		"url": "https://mdbootstrap.com/docs/standard/extended/gallery/#!",
		"id": 42,
		"parentId": "1",
		"dateAddedLocal": "15/04/2021, 02:04:55",
		"dateAddedUTC": "2021-04-14T20:34:55.877Z"
	},
	{
		"index": 35,
		"title": "Animated navbar - code helper",
		"url": "https://mdbootstrap.com/snippets/standard/mdbootstrap/2946064",
		"id": 43,
		"parentId": "1",
		"dateAddedLocal": "15/04/2021, 02:06:31",
		"dateAddedUTC": "2021-04-14T20:36:31.683Z"
	},
	{
		"index": 36,
		"title": "toidicode/template: Share 100 templates HTML5 CSS3 for developer or beginner",
		"url": "https://github.com/toidicode/template",
		"id": 44,
		"parentId": "1",
		"dateAddedLocal": "18/04/2021, 12:35:28",
		"dateAddedUTC": "2021-04-18T07:05:28.438Z"
	},
	{
		"index": 37,
		"title": "Bootstrap 4 Google Map - examples & tutorial. Basic & advanced usage - Material Design for Bootstrap",
		"url": "https://mdbootstrap.com/docs/b4/jquery/javascript/google-maps/",
		"id": 45,
		"parentId": "1",
		"dateAddedLocal": "07/05/2021, 13:23:37",
		"dateAddedUTC": "2021-05-07T07:53:37.914Z"
	},
	{
		"index": 38,
		"title": "My projects | Renderforest",
		"url": "https://www.renderforest.com/profile/my-websites",
		"id": 46,
		"parentId": "1",
		"dateAddedLocal": "13/05/2021, 02:52:24",
		"dateAddedUTC": "2021-05-12T21:22:24.481Z"
	},
	{
		"index": 39,
		"title": "css-protips/translations/es-ES at master · AllThingsSmitty/css-protips",
		"url": "https://github.com/AllThingsSmitty/css-protips/tree/master/translations/es-ES#utilizar-un-css-reset",
		"id": 47,
		"parentId": "1",
		"dateAddedLocal": "12/06/2021, 11:31:44",
		"dateAddedUTC": "2021-06-12T06:01:44.982Z"
	},
	{
		"index": 40,
		"title": "web templates, CSS frameworks, UI libraries, tools and much more",
		"url": "https://github.com/bradtraversy/design-resources-for-developers",
		"id": 48,
		"parentId": "1",
		"dateAddedLocal": "12/06/2021, 11:42:35",
		"dateAddedUTC": "2021-06-12T06:12:35.651Z"
	},
	{
		"index": 41,
		"title": "Chocolat - Responsive lightbox",
		"url": "http://chocolat.insipi.de/#demo",
		"id": 49,
		"parentId": "1",
		"dateAddedLocal": "12/06/2021, 11:44:13",
		"dateAddedUTC": "2021-06-12T06:14:13.233Z"
	},
	{
		"index": 42,
		"title": "Tilt.js - A tiny parallax tilt effect for jQuery",
		"url": "http://gijsroge.github.io/tilt.js/",
		"id": 50,
		"parentId": "1",
		"dateAddedLocal": "12/06/2021, 11:44:55",
		"dateAddedUTC": "2021-06-12T06:14:55.262Z"
	},
	{
		"index": 43,
		"title": "slick - the last carousel you'll ever need",
		"url": "https://kenwheeler.github.io/slick/",
		"id": 51,
		"parentId": "1",
		"dateAddedLocal": "12/06/2021, 11:51:00",
		"dateAddedUTC": "2021-06-12T06:21:00.609Z"
	},
	{
		"index": 44,
		"title": "192.168.1.1/admin/login.asp",
		"url": "http://192.168.1.1/admin/login.asp",
		"id": 52,
		"parentId": "1",
		"dateAddedLocal": "16/07/2021, 13:41:01",
		"dateAddedUTC": "2021-07-16T08:11:01.699Z"
	},
	{
		"index": 45,
		"title": "BasselTech - Redirect",
		"url": "https://basseltech.com/redirect?url=https%3A%2F%2Fjmp.sh%2FWz81wBV",
		"id": 53,
		"parentId": "1",
		"dateAddedLocal": "29/07/2021, 17:07:41",
		"dateAddedUTC": "2021-07-29T11:37:41.531Z"
	},
	{
		"index": 46,
		"title": "javascript - Subscribe to Newsletter Form - Stack Overflow",
		"url": "https://stackoverflow.com/questions/22095078/subscribe-to-newsletter-form",
		"id": 54,
		"parentId": "1",
		"dateAddedLocal": "23/08/2021, 17:04:39",
		"dateAddedUTC": "2021-08-23T11:34:39.982Z"
	},
	{
		"index": 47,
		"title": "Cordova App Templates - Apache Cordova",
		"url": "https://cordova.apache.org/docs/en/latest/guide/cli/template.html#use-a-template",
		"id": 55,
		"parentId": "1",
		"dateAddedLocal": "04/09/2021, 01:28:31",
		"dateAddedUTC": "2021-09-03T19:58:31.472Z"
	},
	{
		"index": 48,
		"title": "18 amazing 🤩 GitHub repositories that will help you 🪄 make a Beautiful Project - DEV Community",
		"url": "https://dev.to/kerthin/18-amazing-github-repositories-that-will-help-you-make-a-beautiful-project-3pgo",
		"id": 56,
		"parentId": "1",
		"dateAddedLocal": "05/09/2021, 10:04:14",
		"dateAddedUTC": "2021-09-05T04:34:14.552Z"
	},
	{
		"index": 50,
		"title": "CVS Mobile Landing Screen Clone",
		"url": "https://codepen.io/bradtraversy/full/RwNoRVm",
		"id": 58,
		"parentId": "1",
		"dateAddedLocal": "21/09/2021, 14:38:58",
		"dateAddedUTC": "2021-09-21T09:08:58.752Z"
	},
	{
		"index": 51,
		"title": "How To Deploy a Django App on App Platform | DigitalOcean",
		"url": "https://www.digitalocean.com/community/tutorials/how-to-deploy-django-to-app-platform",
		"id": 59,
		"parentId": "1",
		"dateAddedLocal": "26/09/2021, 10:42:37",
		"dateAddedUTC": "2021-09-26T05:12:37.210Z"
	},
	{
		"index": 52,
		"title": "greatkart-course/views.py at main · dev-rathankumar/greatkart-course",
		"url": "https://github.com/dev-rathankumar/greatkart-course/blob/main/orders/views.py",
		"id": 60,
		"parentId": "1",
		"dateAddedLocal": "15/10/2021, 15:46:11",
		"dateAddedUTC": "2021-10-15T10:16:11.737Z"
	},
	{
		"index": 53,
		"title": "Manage Your To-Do Lists Using Python and Django – Real Python",
		"url": "https://realpython.com/django-todo-lists/#conclusion",
		"id": 61,
		"parentId": "1",
		"dateAddedLocal": "27/03/2022, 01:07:22",
		"dateAddedUTC": "2022-03-26T19:37:22.154Z"
	},
	{
		"index": 54,
		"title": "Mittal-Analytics/screener: Screener.in is the best research tool for equity investors.",
		"url": "https://github.com/Mittal-Analytics/screener",
		"id": 62,
		"parentId": "1",
		"dateAddedLocal": "01/04/2022, 14:15:18",
		"dateAddedUTC": "2022-04-01T08:45:18.158Z"
	},
	{
		"index": 55,
		"title": "How to Change MySQL Root Password in Linux or Windows",
		"url": "https://phoenixnap.com/kb/how-to-reset-mysql-root-password-windows-linux",
		"id": 63,
		"parentId": "1",
		"dateAddedLocal": "01/04/2022, 17:29:37",
		"dateAddedUTC": "2022-04-01T11:59:37.124Z"
	},
	{
		"index": 56,
		"title": "Poppler for Windows",
		"url": "https://blog.alivate.com.au/poppler-windows/index.html",
		"id": 64,
		"parentId": "1",
		"dateAddedLocal": "02/04/2022, 11:33:39",
		"dateAddedUTC": "2022-04-02T06:03:39.312Z"
	},
	{
		"index": 57,
		"title": "installation - Unable to install pdftotext on Python 3.6, missing poppler - Stack Overflow",
		"url": "https://stackoverflow.com/questions/45912641/",
		"id": 65,
		"parentId": "1",
		"dateAddedLocal": "04/04/2022, 17:21:16",
		"dateAddedUTC": "2022-04-04T11:51:16.653Z"
	},
	{
		"index": 58,
		"title": "Shareholding table, show latest too if available",
		"url": "https://3.basecamp.com/4317112/buckets/17135722/todos/4383759990",
		"id": 66,
		"parentId": "1",
		"dateAddedLocal": "04/04/2022, 17:51:46",
		"dateAddedUTC": "2022-04-04T12:21:46.829Z"
	},
	{
		"index": 59,
		"title": "mysql_secure_installation - MariaDB Knowledge Base",
		"url": "https://mariadb.com/kb/en/mysql_secure_installation/",
		"id": 67,
		"parentId": "1",
		"dateAddedLocal": "04/04/2022, 17:57:30",
		"dateAddedUTC": "2022-04-04T12:27:30.496Z"
	},
	{
		"index": 60,
		"title": "FlexStart Bootstrap Template Demo",
		"url": "https://bootstrapmade.com/demo/FlexStart/",
		"id": 68,
		"parentId": "1",
		"dateAddedLocal": "05/04/2022, 01:34:50",
		"dateAddedUTC": "2022-04-04T20:04:50.357Z"
	},
	{
		"index": 61,
		"title": "Renessa",
		"url": "https://github.toidicode.com/91-renessa/#",
		"id": 69,
		"parentId": "1",
		"dateAddedLocal": "06/04/2022, 01:32:18",
		"dateAddedUTC": "2022-04-05T20:02:18.960Z"
	},
	{
		"index": 62,
		"title": "GROUP BY and Select MAX from each group in Django, 2 queries · GitHub",
		"url": "https://gist.github.com/ryanpitts/1304725/b45a12e835fded8afa5c6f59ea0e4aff9d2b6405",
		"id": 70,
		"parentId": "1",
		"dateAddedLocal": "06/04/2022, 13:22:38",
		"dateAddedUTC": "2022-04-06T07:52:38.302Z"
	},
	{
		"index": 63,
		"title": "10 Git Commands Every Developer Should Know",
		"url": "https://www.freecodecamp.org/news/10-important-git-commands-that-every-developer-should-know/",
		"id": 71,
		"parentId": "1",
		"dateAddedLocal": "07/04/2022, 10:20:09",
		"dateAddedUTC": "2022-04-07T04:50:09.339Z"
	},
	{
		"index": 64,
		"title": "AttributeError at /company/AKZOINDIA/",
		"url": "http://127.0.0.1:8000/company/AKZOINDIA/#quarters",
		"id": 72,
		"parentId": "1",
		"dateAddedLocal": "11/04/2022, 12:55:21",
		"dateAddedUTC": "2022-04-11T07:25:21.971Z"
	},
	{
		"index": 65,
		"title": "Loanday | Template",
		"url": "https://preview.colorlib.com/theme/loanday/",
		"id": 73,
		"parentId": "1",
		"dateAddedLocal": "11/04/2022, 23:35:47",
		"dateAddedUTC": "2022-04-11T18:05:47.790Z"
	},
	{
		"index": 66,
		"title": "School Management System Project In Django With Source Code - 2022",
		"url": "https://itsourcecode.com/free-projects/python-projects/school-management-system-project-in-django-with-source-code/",
		"id": 74,
		"parentId": "1",
		"dateAddedLocal": "13/04/2022, 13:23:08",
		"dateAddedUTC": "2022-04-13T07:53:08.537Z"
	},
	{
		"index": 67,
		"title": "Customer Feedback System Project in Django with Source Code | Free Django Projects with Source Code [video]",
		"url": "https://itsourcecode.com/video/ezoic/",
		"id": 75,
		"parentId": "1",
		"dateAddedLocal": "13/04/2022, 13:55:31",
		"dateAddedUTC": "2022-04-13T08:25:31.943Z"
	},
	{
		"index": 68,
		"title": "178 Python Projects with Source Code | by Aman Kharwal | Medium",
		"url": "https://amankharwal.medium.com/130-python-projects-with-source-code-61f498591bb",
		"id": 76,
		"parentId": "1",
		"dateAddedLocal": "26/04/2022, 20:43:33",
		"dateAddedUTC": "2022-04-26T15:13:33.746Z"
	},
	{
		"index": 69,
		"title": "Creating Dynamic Forms with Django | Caktus Group",
		"url": "https://www.caktusgroup.com/blog/2018/05/07/creating-dynamic-forms-django/",
		"id": 77,
		"parentId": "1",
		"dateAddedLocal": "28/04/2022, 14:56:15",
		"dateAddedUTC": "2022-04-28T09:26:15.365Z"
	},
	{
		"index": 70,
		"title": "Gmail",
		"url": "https://accounts.google.com/b/0/AddMailService",
		"id": 78,
		"parentId": "1",
		"dateAddedLocal": "15/08/2022, 02:38:42",
		"dateAddedUTC": "2022-08-14T21:08:42.830Z"
	},
	{
		"index": 71,
		"title": "YouTube",
		"url": "https://youtube.com/",
		"id": 79,
		"parentId": "1",
		"dateAddedLocal": "15/08/2022, 02:38:42",
		"dateAddedUTC": "2022-08-14T21:08:42.832Z"
	},
	{
		"index": 72,
		"title": "Maps",
		"url": "https://maps.google.com/",
		"id": 80,
		"parentId": "1",
		"dateAddedLocal": "15/08/2022, 02:38:42",
		"dateAddedUTC": "2022-08-14T21:08:42.832Z"
	},
	{
		"index": 73,
		"title": "How to use Git and GitHub for beginners",
		"url": "https://www.blog.edmondhui.com/how-to-use-git",
		"id": 81,
		"parentId": "1",
		"dateAddedLocal": "18/08/2022, 22:12:43",
		"dateAddedUTC": "2022-08-18T16:42:43.146Z"
	},
	{
		"index": 74,
		"title": "Git: Cheat Sheet (advanced) - DEV Community",
		"url": "https://dev.to/maxpou/git-cheat-sheet-advanced-3a17",
		"id": 82,
		"parentId": "1",
		"dateAddedLocal": "23/08/2022, 12:43:51",
		"dateAddedUTC": "2022-08-23T07:13:51.669Z"
	},
	{
		"index": 75,
		"title": "Scheduling tasks Using Python",
		"url": "https://linuxhint.com/schedule_tasks_with_python/",
		"id": 83,
		"parentId": "1",
		"dateAddedLocal": "23/08/2022, 16:11:24",
		"dateAddedUTC": "2022-08-23T10:41:24.865Z"
	},
	{
		"index": 76,
		"title": "kakengloh/tsk at producthunt",
		"url": "https://github.com/kakengloh/tsk?ref=producthunt",
		"id": 84,
		"parentId": "1",
		"dateAddedLocal": "29/08/2022, 10:31:35",
		"dateAddedUTC": "2022-08-29T05:01:35.376Z"
	},
	{
		"index": 77,
		"title": "14 Best Linux Terminal Emulators With Extra Features [2021]",
		"url": "https://itsfoss.com/linux-terminal-emulators/",
		"id": 85,
		"parentId": "1",
		"dateAddedLocal": "29/08/2022, 15:02:38",
		"dateAddedUTC": "2022-08-29T09:32:38.530Z"
	},
	{
		"index": 78,
		"title": "egorsmkv/simple-django-login-and-register: An example of Django project with basic user functionality.",
		"url": "https://github.com/egorsmkv/simple-django-login-and-register",
		"id": 86,
		"parentId": "1",
		"dateAddedLocal": "01/09/2022, 11:13:14",
		"dateAddedUTC": "2022-09-01T05:43:14.708Z"
	},
	{
		"index": 79,
		"title": "CodeSee: General Settings",
		"url": "https://app.codesee.io/maps/settings/a/9096f960-859f-4fa7-8d67-08faf0a479b0/general-settings",
		"id": 87,
		"parentId": "1",
		"dateAddedLocal": "05/09/2022, 13:38:33",
		"dateAddedUTC": "2022-09-05T08:08:33.892Z"
	},
	{
		"index": 80,
		"title": "Image Filters Online | 10015 Tools",
		"url": "https://10015.io/tools/image-filters",
		"id": 88,
		"parentId": "1",
		"dateAddedLocal": "05/09/2022, 13:50:17",
		"dateAddedUTC": "2022-09-05T08:20:17.997Z"
	},
	{
		"index": 81,
		"title": "SVG library open source made by Snoweb for Django, HTML and React",
		"url": "https://www.snoweb-svg.com/",
		"id": 89,
		"parentId": "1",
		"dateAddedLocal": "05/09/2022, 13:51:55",
		"dateAddedUTC": "2022-09-05T08:21:55.575Z"
	},
	{
		"index": 82,
		"title": "The 60 Hottest Front-end Tools of 2021 | CSS-Tricks - CSS-Tricks",
		"url": "https://css-tricks.com/hottest-front-end-tools-in-2021/",
		"id": 90,
		"parentId": "1",
		"dateAddedLocal": "05/09/2022, 13:53:13",
		"dateAddedUTC": "2022-09-05T08:23:13.157Z"
	},
	{
		"index": 83,
		"title": "Technology collection of free photos",
		"url": "https://skuawk.com/technology.html",
		"id": 91,
		"parentId": "1",
		"dateAddedLocal": "05/09/2022, 13:54:07",
		"dateAddedUTC": "2022-09-05T08:24:07.942Z"
	},
	{
		"index": 84,
		"title": "CortexJS",
		"url": "https://cortexjs.io/compute-engine/demo/",
		"id": 92,
		"parentId": "1",
		"dateAddedLocal": "05/09/2022, 16:38:44",
		"dateAddedUTC": "2022-09-05T11:08:44.343Z"
	},
	{
		"index": 85,
		"title": "AutoDraw",
		"url": "https://www.autodraw.com/",
		"id": 93,
		"parentId": "1",
		"dateAddedLocal": "05/09/2022, 16:45:42",
		"dateAddedUTC": "2022-09-05T11:15:42.322Z"
	},
	{
		"index": 86,
		"title": "HTML & CSS for Beginners (MEGA Free Course!)",
		"url": "https://webdesign.tutsplus.com/articles/html-css-for-beginners-mega-free-course--cms-93199",
		"id": 94,
		"parentId": "1",
		"dateAddedLocal": "08/09/2022, 21:05:57",
		"dateAddedUTC": "2022-09-08T15:35:57.123Z"
	},
	{
		"index": 87,
		"title": "Bullet Proofing Django Models | Haki Benita",
		"url": "https://hakibenita.com/bullet-proofing-django-models",
		"id": 95,
		"parentId": "1",
		"dateAddedLocal": "09/09/2022, 11:37:47",
		"dateAddedUTC": "2022-09-09T06:07:47.669Z"
	},
	{
		"index": 88,
		"title": "(26) Generate database diagram(ERD) with Django Extensions Automatically. | LinkedIn",
		"url": "https://www.linkedin.com/pulse/generate-database-diagramerd-django-extensions-automatically-srujan-s/",
		"id": 96,
		"parentId": "1",
		"dateAddedLocal": "10/09/2022, 16:44:55",
		"dateAddedUTC": "2022-09-10T11:14:55.345Z"
	},
	{
		"index": 89,
		"title": "App passwords",
		"url": "https://myaccount.google.com/",
		"id": 97,
		"parentId": "1",
		"dateAddedLocal": "12/09/2022, 23:02:43",
		"dateAddedUTC": "2022-09-12T17:32:43.437Z"
	},
	{
		"index": 90,
		"title": "10 Powerful Python One-Liners. Python one-liners can be just as… | by Ishaan Gupta | Sep, 2022 | Python in Plain English",
		"url": "https://python.plainenglish.io/10-powerful-python-one-liners-d8c9b86c3cf0",
		"id": 98,
		"parentId": "1",
		"dateAddedLocal": "13/09/2022, 14:33:23",
		"dateAddedUTC": "2022-09-13T09:03:23.323Z"
	},
	{
		"index": 91,
		"title": "5 Python Concepts That Will Advance Your Career Python in Plain English",
		"url": "https://python.plainenglish.io/5-python-concepts-that-will-advance-your-career-16cb8ccbf4f7",
		"id": 99,
		"parentId": "1",
		"dateAddedLocal": "13/09/2022, 14:33:32",
		"dateAddedUTC": "2022-09-13T09:03:32.012Z"
	},
	{
		"index": 92,
		"title": "Welcome! | Haki Benita",
		"url": "https://hakibenita.com/",
		"id": 100,
		"parentId": "1",
		"dateAddedLocal": "14/09/2022, 10:42:59",
		"dateAddedUTC": "2022-09-14T05:12:59.159Z"
	},
	{
		"index": 93,
		"title": "Art Hub AI - Discover, upload and share AI generated art pieces.",
		"url": "https://arthub.ai/",
		"id": 101,
		"parentId": "1",
		"dateAddedLocal": "14/09/2022, 10:49:48",
		"dateAddedUTC": "2022-09-14T05:19:48.836Z"
	},
	{
		"index": 94,
		"title": "Working with Dates and Times with Day.js",
		"url": "https://blog.openreplay.com/working-with-dates-and-times-with-day-js",
		"id": 102,
		"parentId": "1",
		"dateAddedLocal": "14/09/2022, 17:14:26",
		"dateAddedUTC": "2022-09-14T11:44:26.957Z"
	},
	{
		"index": 95,
		"title": "Search, sort, filters, flexibility to tables, list and more! - List.js",
		"url": "https://listjs.com/",
		"id": 103,
		"parentId": "1",
		"dateAddedLocal": "19/09/2022, 15:37:41",
		"dateAddedUTC": "2022-09-19T10:07:41.343Z"
	},
	{
		"index": 96,
		"title": "Basic or Simple resume templates [Word & PDF] Download for free",
		"url": "https://resume.io/resume-templates/simple",
		"id": 104,
		"parentId": "1",
		"dateAddedLocal": "19/09/2022, 17:29:59",
		"dateAddedUTC": "2022-09-19T11:59:59.528Z"
	},
	{
		"index": 97,
		"title": "Business Name | LOGO.com",
		"url": "https://app.logo.com/editor/business-name",
		"id": 105,
		"parentId": "1",
		"dateAddedLocal": "21/09/2022, 10:04:46",
		"dateAddedUTC": "2022-09-21T04:34:46.868Z"
	},
	{
		"index": 98,
		"title": "Starship: Cross-Shell Prompt",
		"url": "https://starship.rs/",
		"id": 106,
		"parentId": "1",
		"dateAddedLocal": "27/09/2022, 15:33:02",
		"dateAddedUTC": "2022-09-27T10:03:02.846Z"
	},
	{
		"index": 99,
		"title": "A very simple Apache access log parser in Python",
		"url": "https://gist.github.com/sumeetpareek/9644255",
		"id": 107,
		"parentId": "1",
		"dateAddedLocal": "12/10/2022, 12:59:31",
		"dateAddedUTC": "2022-10-12T07:29:31.497Z"
	},
	{
		"index": 100,
		"title": "Learn the OSI model in 5 minutes | Opensource.com",
		"url": "https://opensource.com/article/",
		"id": 108,
		"parentId": "1",
		"dateAddedLocal": "12/10/2022, 14:01:23",
		"dateAddedUTC": "2022-10-12T08:31:23.010Z"
	},
	{
		"index": 101,
		"title": "Software | Code Time",
		"url": "https://app.software.com/dashboard/code_time",
		"id": 109,
		"parentId": "1",
		"dateAddedLocal": "28/10/2022, 15:19:50",
		"dateAddedUTC": "2022-10-28T09:49:50.124Z"
	},
	{
		"index": 102,
		"title": "Get Started With Django Part 2: Django User Management – Real Python",
		"url": "https://realpython.com/django-user-management/",
		"id": 110,
		"parentId": "1",
		"dateAddedLocal": "01/11/2022, 13:15:15",
		"dateAddedUTC": "2022-11-01T07:45:15.632Z"
	},
	{
		"index": 103,
		"title": "Cute Isometric Objects For Design | Isometriclove",
		"url": "https://isometriclove.com/",
		"id": 111,
		"parentId": "1",
		"dateAddedLocal": "05/11/2022, 13:34:15",
		"dateAddedUTC": "2022-11-05T08:04:15.391Z"
	},
	{
		"index": 104,
		"title": "PY4E - Python for Everybody",
		"url": "https://www.py4e.com/lessons",
		"id": 112,
		"parentId": "1",
		"dateAddedLocal": "15/11/2022, 13:46:42",
		"dateAddedUTC": "2022-11-15T08:16:42.755Z"
	},
	{
		"index": 105,
		"title": "Top 12 Advanced Git Commands to Know",
		"url": "https://blog.openreplay.com/top-dozen-advanced-git-commands-to-know/",
		"id": 113,
		"parentId": "1",
		"dateAddedLocal": "16/11/2022, 10:41:40",
		"dateAddedUTC": "2022-11-16T05:11:40.316Z"
	},
	{
		"index": 106,
		"title": "Replit | Flet",
		"url": "https://flet.dev/docs/guides/python/deploying-web-app/replit",
		"id": 114,
		"parentId": "1",
		"dateAddedLocal": "16/11/2022, 12:11:53",
		"dateAddedUTC": "2022-11-16T06:41:53.043Z"
	},
	{
		"index": 107,
		"title": "himanshu-gupta · Billing · Fly",
		"url": "https://fly.io/dashboard/himanshu-gupta/billing",
		"id": 115,
		"parentId": "1",
		"dateAddedLocal": "16/11/2022, 12:26:12",
		"dateAddedUTC": "2022-11-16T06:56:12.737Z"
	},
	{
		"index": 108,
		"title": "Understanding the Levenshtein Distance Equation for Beginners | by Ethan Nam | Medium",
		"url": "https://medium.com/@ethannam/understanding-the-levenshtein-distance-equation-for-beginners-c4285a5604f0",
		"id": 116,
		"parentId": "1",
		"dateAddedLocal": "16/11/2022, 15:56:42",
		"dateAddedUTC": "2022-11-16T10:26:42.901Z"
	},
	{
		"index": 109,
		"title": "Select warehouse to change | Django site admin",
		"url": "http://127.0.0.1:8888/dont_be_evil/midend/warehouse/?q=PI++Insu",
		"id": 117,
		"parentId": "1",
		"dateAddedLocal": "23/11/2022, 12:54:49",
		"dateAddedUTC": "2022-11-23T07:24:49.188Z"
	},
	{
		"index": 110,
		"title": "chubin/cheat.sh: the only cheat sheet you need",
		"url": "https://github.com/chubin/cheat.sh#installation",
		"id": 118,
		"parentId": "1",
		"dateAddedLocal": "30/11/2022, 11:18:52",
		"dateAddedUTC": "2022-11-30T05:48:52.039Z"
	},
	{
		"index": 111,
		"title": "Customize the Django Admin With Python – Real Python",
		"url": "https://realpython.com/customize-django-admin-python/#modifying-a-change-list-using-list_display",
		"id": 119,
		"parentId": "1",
		"dateAddedLocal": "05/12/2022, 15:22:59",
		"dateAddedUTC": "2022-12-05T09:52:59.157Z"
	},
	{
		"index": 112,
		"title": "Boost Your Coding Fu With Visual Studio Code and Vim | Barbarian Meets Coding",
		"url": "https://www.barbarianmeetscoding.com/blog/boost-your-coding-fu-with-vscode-and-vim",
		"id": 215,
		"parentId": "1",
		"dateAddedLocal": "19/12/2022, 15:50:50",
		"dateAddedUTC": "2022-12-19T10:20:50.749Z"
	},
	{
		"index": 113,
		"title": "15 Killer Jupyter Hacks That Are Guaranteed To Save you Hours Medium",
		"url": "https://medium.com/geekculture/15-best-jupyter-tips-tricks-754831bba408",
		"id": 217,
		"parentId": "1",
		"dateAddedLocal": "24/12/2022, 16:39:52",
		"dateAddedUTC": "2022-12-24T11:09:52.392Z"
	},
	{
		"index": 114,
		"title": "Web Tools #493 - Top 30 Tools of 2022",
		"url": "https://mailchi.mp/webtoolsweekly/web-tools-493",
		"id": 219,
		"parentId": "1",
		"dateAddedLocal": "05/01/2023, 14:49:18",
		"dateAddedUTC": "2023-01-05T09:19:18.185Z"
	},
	{
		"index": 115,
		"title": "todo-app-django-rest-framework/views.py at master",
		"url": "https://github.com/ahmetumitbayram/todo-app-django-rest-framework/blob/master/api/views.py",
		"id": 221,
		"parentId": "1",
		"dateAddedLocal": "06/01/2023, 15:26:23",
		"dateAddedUTC": "2023-01-06T09:56:23.439Z"
	},
	{
		"index": 116,
		"title": "Poet.so | Create Beautiful Images of Twitter Posts",
		"url": "https://poet.so/",
		"id": 223,
		"parentId": "1",
		"dateAddedLocal": "17/01/2023, 16:50:26",
		"dateAddedUTC": "2023-01-17T11:20:26.278Z"
	},
	{
		"index": 117,
		"title": "Free Typing Test - Typing Speed Tests - Learn Your WPM - Typing.com",
		"url": "https://www.typing.com/student/tests",
		"id": 225,
		"parentId": "1",
		"dateAddedLocal": "25/01/2023, 19:44:24",
		"dateAddedUTC": "2023-01-25T14:14:24.539Z"
	},
	{
		"index": 118,
		"title": "Chrome Extensions of the Month - January 2023 - DEV Community 👩‍💻👨‍💻",
		"url": "https://dev.to/j471n/chrome-extensions-of-the-month-january-2023-4agc#chatgpt-for-google",
		"id": 227,
		"parentId": "1",
		"dateAddedLocal": "04/02/2023, 13:44:53",
		"dateAddedUTC": "2023-02-04T08:14:53.280Z"
	},
	{
		"index": 119,
		"title": "Understand Group by in Django with SQL | Haki Benita",
		"url": "https://hakibenita.com/django-group-by-sql",
		"id": 229,
		"parentId": "1",
		"dateAddedLocal": "21/02/2023, 10:11:00",
		"dateAddedUTC": "2023-02-21T04:41:00.678Z"
	},
	{
		"index": 120,
		"title": "50+ python projects with source code | by inprogrammer | Jan, 2023 | Medium",
		"url": "https://medium.com/@inprogrammer/",
		"id": 231,
		"parentId": "1",
		"dateAddedLocal": "25/02/2023, 15:25:46",
		"dateAddedUTC": "2023-02-25T09:55:46.688Z"
	},
	{
		"index": 121,
		"title": "@codehub | Linktree",
		"url": "https://linktr.ee/codehub",
		"id": 232,
		"parentId": "1",
		"dateAddedLocal": "25/02/2023, 15:25:52",
		"dateAddedUTC": "2023-02-25T09:55:52.028Z"
	},
	{
		"index": 122,
		"title": "afgprogrammer/Task-Template: A task management template design with HTML and CSS",
		"url": "https://github.com/afgprogrammer/Task-Template",
		"id": 234,
		"parentId": "1",
		"dateAddedLocal": "10/03/2023, 13:13:25",
		"dateAddedUTC": "2023-03-10T07:43:25.145Z"
	},
	{
		"index": 123,
		"title": "Task Management Dashboard UI",
		"url": "https://codepen.io/aybukeceylan/pen/gOpbRPO",
		"id": 235,
		"parentId": "1",
		"dateAddedLocal": "10/03/2023, 13:21:03",
		"dateAddedUTC": "2023-03-10T07:51:03.869Z"
	},
	{
		"index": 124,
		"title": "30 Days Extreme Coding Challenge - HTML and CSS Series' Articles - DEV Community",
		"url": "https://dev.to/somanathgoudar/series/12800",
		"id": 236,
		"parentId": "1",
		"dateAddedLocal": "10/03/2023, 13:23:35",
		"dateAddedUTC": "2023-03-10T07:53:35.099Z"
	},
	{
		"index": 125,
		"title": "🤯 30DaysChallenge - 30 Days Extreme HTML & CSS CHALLENGE 🤯 - DEV Community",
		"url": "https://dev.to/somanathgoudar/30dayschallenge-30-days-extreme-html-css-challenge-50k1",
		"id": 237,
		"parentId": "1",
		"dateAddedLocal": "10/03/2023, 13:24:10",
		"dateAddedUTC": "2023-03-10T07:54:10.451Z"
	},
	{
		"index": 126,
		"title": "Logik | Responsive Bootstrap 5 Admin Dashboard Template",
		"url": "https://templates.iqonic.design/",
		"id": 238,
		"parentId": "1",
		"dateAddedLocal": "10/03/2023, 13:35:59",
		"dateAddedUTC": "2023-03-10T08:05:59.642Z"
	},
	{
		"index": 0,
		"title": "Flipkart",
		"url": "https://www.flipkart.com/sonata-nf7924nm01c-watch-men/p/itmf3zhmfgtszeby?lid=LSTWATDP98GBUTTJ4VQNCUHQB&pid=WATDP98GBUTTJ4VQ",
		"id": 120,
		"parentId": "3",
		"dateAddedLocal": "08/10/2018, 16:28:20",
		"dateAddedUTC": "2018-10-08T10:58:20.455Z"
	},
	{
		"index": 1,
		"title": "[Sponsored] Software Christmas Madness",
		"url": "https://www.sammobile.com/2018/12/11/",
		"id": 121,
		"parentId": "3",
		"dateAddedLocal": "12/12/2018, 09:14:31",
		"dateAddedUTC": "2018-12-12T03:44:31.935Z"
	},
	{
		"index": 2,
		"title": "10 Data Structure, Algorithms, and Programming Courses to Crack Any Coding Interview",
		"url": "https://hackernoon.com/10-data-structure-algorithms-and-programming",
		"id": 122,
		"parentId": "3",
		"dateAddedLocal": "13/03/2019, 02:09:55",
		"dateAddedUTC": "2019-03-12T20:39:55.259Z"
	},
	{
		"index": 3,
		"title": "NGO Management System: NGO Project Management System",
		"url": "http://ngomanagementsystem.blogspot.com/2012/12/ngo-project-management-system.html?m=1",
		"id": 123,
		"parentId": "3",
		"dateAddedLocal": "13/03/2019, 13:48:59",
		"dateAddedUTC": "2019-03-13T08:18:59.732Z"
	},
	{
		"index": 4,
		"title": "Council Post: Interface Design: Six Ways To Create A Great User Experience",
		"url": "https://www.forbes.com/sites/forbestechcouncil/2019/05/07",
		"id": 124,
		"parentId": "3",
		"dateAddedLocal": "08/05/2019, 08:31:40",
		"dateAddedUTC": "2019-05-08T03:01:40.120Z"
	},
	{
		"index": 5,
		"title": "Programming, Data Structures And Algorithms Using Python - - Announcements",
		"url": "https://onlinecourses.nptel.ac.in/noc20_cs26/announcements?force=true",
		"id": 125,
		"parentId": "3",
		"dateAddedLocal": "15/02/2020, 22:27:12",
		"dateAddedUTC": "2020-02-15T16:57:12.041Z"
	},
	{
		"index": 6,
		"title": "DevYouTubeList/README.md at master · techwithtim/DevYouTubeList · GitHub",
		"url": "https://github.com/techwithtim/DevYouTubeList/blob/master/README.md",
		"id": 126,
		"parentId": "3",
		"dateAddedLocal": "16/05/2020, 02:41:16",
		"dateAddedUTC": "2020-05-15T21:11:16.723Z"
	},
	{
		"index": 7,
		"title": "VisuAlgo - visualising data structures and algorithms through animation",
		"url": "https://visualgo.net/en",
		"id": 127,
		"parentId": "3",
		"dateAddedLocal": "19/05/2020, 21:56:07",
		"dateAddedUTC": "2020-05-19T16:26:07.658Z"
	},
	{
		"index": 8,
		"title": "How to access VitalSource Helps – Bookshelf Support",
		"url": "https://support.vitalsource.com/hc/en-us/articles/360046201493-How-to-access-VitalSource-Helps",
		"id": 128,
		"parentId": "3",
		"dateAddedLocal": "19/05/2020, 22:15:25",
		"dateAddedUTC": "2020-05-19T16:45:25.392Z"
	},
	{
		"index": 9,
		"title": "GDT - How to make an Operating System",
		"url": "https://samypesse.gitbook.io/how-to-create-an-operating-system/chapter-6",
		"id": 129,
		"parentId": "3",
		"dateAddedLocal": "19/05/2020, 22:24:07",
		"dateAddedUTC": "2020-05-19T16:54:07.367Z"
	},
	{
		"index": 10,
		"title": "How-to-Make-a-Computer-Operating-System/Chapter-1 at master",
		"url": "https://github.com/SamyPesse/How-to-Make-a-Computer-Operating-System/tree/master/Chapter-1",
		"id": 130,
		"parentId": "3",
		"dateAddedLocal": "19/05/2020, 22:25:10",
		"dateAddedUTC": "2020-05-19T16:55:10.199Z"
	},
	{
		"index": 11,
		"title": "Computer Networks: A Systems Approach",
		"url": "https://book.systemsapproach.org/",
		"id": 131,
		"parentId": "3",
		"dateAddedLocal": "19/05/2020, 22:28:06",
		"dateAddedUTC": "2020-05-19T16:58:06.246Z"
	},
	{
		"index": 12,
		"title": "Introductory HTTP - Beginner-friendly book on HTTP",
		"url": "https://launchschool.com/books/http/read/introduction",
		"id": 132,
		"parentId": "3",
		"dateAddedLocal": "19/05/2020, 22:33:05",
		"dateAddedUTC": "2020-05-19T17:03:05.166Z"
	},
	{
		"index": 13,
		"title": "Django RESTful Web Services",
		"url": "https://subscription.packtpub.com/book/web-development/9781788833929",
		"id": 133,
		"parentId": "3",
		"dateAddedLocal": "19/05/2020, 22:41:23",
		"dateAddedUTC": "2020-05-19T17:11:23.646Z"
	},
	{
		"index": 14,
		"title": "Free Learning - Your daily programming eBook from Packt",
		"url": "https://www.packtpub.com/free-learning",
		"id": 134,
		"parentId": "3",
		"dateAddedLocal": "19/05/2020, 22:44:20",
		"dateAddedUTC": "2020-05-19T17:14:20.974Z"
	},
	{
		"index": 15,
		"title": "svgAsset 1",
		"url": "file:///C:/Users/Himanshu/Pictures/Screenshots/SVG/svgAsset%201.svg",
		"id": 135,
		"parentId": "3",
		"dateAddedLocal": "20/05/2020, 06:34:15",
		"dateAddedUTC": "2020-05-20T01:04:15.932Z"
	},
	{
		"index": 16,
		"title": "35 Inspiring Programming Quotes With Visuals For Developers and Coders",
		"url": "https://medium.com/@3rdwave_themes/",
		"id": 136,
		"parentId": "3",
		"dateAddedLocal": "21/05/2020, 18:24:04",
		"dateAddedUTC": "2020-05-21T12:54:04.359Z"
	},
	{
		"index": 17,
		"title": "Cracking the Google Coding Interview - Better Programming - Medium",
		"url": "https://medium.com/better-programming/cracking-the-google-coding-interview-3b8dd29b0d6a",
		"id": 137,
		"parentId": "3",
		"dateAddedLocal": "21/05/2020, 19:30:02",
		"dateAddedUTC": "2020-05-21T14:00:02.796Z"
	},
	{
		"index": 18,
		"title": "Ace the Google Coding Interview | All You Need to Know | CodingInterview.com",
		"url": "https://www.codinginterview.com/google",
		"id": 138,
		"parentId": "3",
		"dateAddedLocal": "21/05/2020, 19:58:54",
		"dateAddedUTC": "2020-05-21T14:28:54.472Z"
	},
	{
		"index": 19,
		"title": "Grokking the Behavioral Interview - Learn Interactively",
		"url": "https://www.educative.io/courses/grokking-the-behavioral-interview",
		"id": 139,
		"parentId": "3",
		"dateAddedLocal": "21/05/2020, 20:04:07",
		"dateAddedUTC": "2020-05-21T14:34:07.359Z"
	},
	{
		"index": 20,
		"title": "Interview - Google Careers",
		"url": "https://careers.google.com/how-we-hire/interview/#interviews-for-software-engineering-and-technical-roles",
		"id": 140,
		"parentId": "3",
		"dateAddedLocal": "21/05/2020, 20:04:22",
		"dateAddedUTC": "2020-05-21T14:34:22.887Z"
	},
	{
		"index": 21,
		"title": "Python interview question guide: how to code a linked list",
		"url": "https://medium.com/free-code-camp/python-interview-question-guide-how-to-code-a-linked-list-fd77cbbd367d",
		"id": 141,
		"parentId": "3",
		"dateAddedLocal": "21/05/2020, 20:07:01",
		"dateAddedUTC": "2020-05-21T14:37:01.143Z"
	},
	{
		"index": 22,
		"title": "Google Interview Question Guide: Delete Reoccurring Characters with Python",
		"url": "https://medium.com/free-code-camp/solving-a-google-interview-question-python-2-code-included-eddefcaeffb2",
		"id": 142,
		"parentId": "3",
		"dateAddedLocal": "21/05/2020, 20:07:03",
		"dateAddedUTC": "2020-05-21T14:37:03.743Z"
	},
	{
		"index": 23,
		"title": "ePass Application Form",
		"url": "http://164.100.68.164/upepass2/apply_epass_UP_new.aspx",
		"id": 143,
		"parentId": "3",
		"dateAddedLocal": "23/05/2020, 12:43:16",
		"dateAddedUTC": "2020-05-23T07:13:16.417Z"
	},
	{
		"index": 24,
		"title": "The Most Advanced WYSIWYG HTML Editor | TinyMCE",
		"url": "https://www.tiny.cloud/",
		"id": 144,
		"parentId": "3",
		"dateAddedLocal": "03/06/2020, 13:23:46",
		"dateAddedUTC": "2020-06-03T07:53:46.282Z"
	},
	{
		"index": 25,
		"title": "Infosys Freshers Registration Drive 2020 Across Uttar Pradesh - IT Jobs - Information Technology Career",
		"url": "https://it-jobs.jobsforceindia.com/jobs/infosys-freshers-drive-2020-jobs-near-me-in-alambagh-lucknow-uttar-pradesh/amp/?utm_campaign=google_jobs_apply&utm_source=google_jobs_apply&utm_medium=organic",
		"id": 145,
		"parentId": "3",
		"dateAddedLocal": "10/06/2020, 00:22:33",
		"dateAddedUTC": "2020-06-09T18:52:33.825Z"
	},
	{
		"index": 26,
		"title": "Install Windows Subsystem for Linux (WSL) on Windows 10 | Microsoft Docs",
		"url": "https://docs.microsoft.com/en-us/windows/wsl/install-win10",
		"id": 146,
		"parentId": "3",
		"dateAddedLocal": "20/06/2020, 01:04:52",
		"dateAddedUTC": "2020-06-19T19:34:52.155Z"
	},
	{
		"index": 27,
		"title": "FancyZones Overview · microsoft/PowerToys Wiki",
		"url": "https://github.com/microsoft/PowerToys/wiki/FancyZones-Overview",
		"id": 147,
		"parentId": "3",
		"dateAddedLocal": "20/06/2020, 01:37:22",
		"dateAddedUTC": "2020-06-19T20:07:22.283Z"
	},
	{
		"index": 28,
		"title": "Big-O Algorithm Complexity Cheat Sheet (Know Thy Complexities!) @ericdrowell",
		"url": "https://www.bigocheatsheet.com/",
		"id": 148,
		"parentId": "3",
		"dateAddedLocal": "25/06/2020, 13:53:49",
		"dateAddedUTC": "2020-06-25T08:23:49.111Z"
	},
	{
		"index": 29,
		"title": "The definitive guide to the coding interview - Andrei Margeloiu - Medium",
		"url": "https://medium.com/@andreimargeloiu/the-definitive-guide-to-the-coding-interview-2704d166664c",
		"id": 149,
		"parentId": "3",
		"dateAddedLocal": "25/06/2020, 13:54:55",
		"dateAddedUTC": "2020-06-25T08:24:55.439Z"
	},
	{
		"index": 30,
		"title": "How to learn mathematics for machine learning - Quora",
		"url": "https://www.quora.com/How-do-I-learn-mathematics-for-machine-learning",
		"id": 150,
		"parentId": "3",
		"dateAddedLocal": "25/06/2020, 13:57:46",
		"dateAddedUTC": "2020-06-25T08:27:46.576Z"
	},
	{
		"index": 31,
		"title": "Python Data Type: Dictionary - Exercises, Practice, Solution - w3resource",
		"url": "https://www.w3resource.com/python-exercises/dictionary/",
		"id": 151,
		"parentId": "3",
		"dateAddedLocal": "30/06/2020, 18:48:40",
		"dateAddedUTC": "2020-06-30T13:18:40.559Z"
	},
	{
		"index": 32,
		"title": "machine learning - Learn Anything",
		"url": "https://learn-anything.xyz/machine-learning",
		"id": 152,
		"parentId": "3",
		"dateAddedLocal": "30/06/2020, 18:56:18",
		"dateAddedUTC": "2020-06-30T13:26:18.407Z"
	},
	{
		"index": 33,
		"title": "Coding Train",
		"url": "https://github.com/CodingTrain",
		"id": 153,
		"parentId": "3",
		"dateAddedLocal": "30/06/2020, 18:57:35",
		"dateAddedUTC": "2020-06-30T13:27:35.251Z"
	},
	{
		"index": 34,
		"title": "Huge update! Interactive Python coding ",
		"url": "https://github.com/voxsim/interactive-coding-challenges",
		"id": 154,
		"parentId": "3",
		"dateAddedLocal": "30/06/2020, 20:25:29",
		"dateAddedUTC": "2020-06-30T14:55:29.000Z"
	},
	{
		"index": 35,
		"title": "rougier/numpy-100: 100 numpy exercises (with solutions)",
		"url": "https://github.com/rougier/numpy-100",
		"id": 155,
		"parentId": "3",
		"dateAddedLocal": "30/06/2020, 20:27:34",
		"dateAddedUTC": "2020-06-30T14:57:34.151Z"
	},
	{
		"index": 36,
		"title": "Data Structures & Algorithms in Python - Udacity",
		"url": "https://classroom.udacity.com/courses/ud513/lessons/7174469398/concepts/71212749920923#",
		"id": 156,
		"parentId": "3",
		"dateAddedLocal": "04/07/2020, 05:17:35",
		"dateAddedUTC": "2020-07-03T23:47:35.457Z"
	},
	{
		"index": 37,
		"title": "Python Exercises, Practice, Solution - w3resource",
		"url": "https://www.w3resource.com/python-exercises/",
		"id": 157,
		"parentId": "3",
		"dateAddedLocal": "06/07/2020, 18:35:41",
		"dateAddedUTC": "2020-07-06T13:05:41.026Z"
	},
	{
		"index": 38,
		"title": "Web Vitals",
		"url": "https://web.dev/vitals/",
		"id": 158,
		"parentId": "3",
		"dateAddedLocal": "07/07/2020, 10:58:08",
		"dateAddedUTC": "2020-07-07T05:28:08.478Z"
	},
	{
		"index": 39,
		"title": "Class 9th Maths - Video Tutorial In Hindi | Magnet Brains",
		"url": "https://www.magnetbrains.com/course/class-ix-mathematics-ncert/#",
		"id": 159,
		"parentId": "3",
		"dateAddedLocal": "09/07/2020, 21:11:29",
		"dateAddedUTC": "2020-07-09T15:41:29.039Z"
	},
	{
		"index": 40,
		"title": "Facebook",
		"url": "https://m.facebook.com/",
		"id": 160,
		"parentId": "3",
		"dateAddedLocal": "23/02/2021, 16:28:23",
		"dateAddedUTC": "2021-02-23T10:58:23.632Z"
	},
	{
		"index": 41,
		"title": "How to disable or enable buttons using Javascript and jQuery",
		"url": "https://flexiple.com/disable-button-javascript/",
		"id": 161,
		"parentId": "3",
		"dateAddedLocal": "30/04/2022, 22:39:29",
		"dateAddedUTC": "2022-04-30T17:09:29.696Z"
	},
	{
		"index": 42,
		"title": "yeazin/Multi-Authors-advanced-Django-Blog",
		"url": "https://github.com/yeazin/Multi-Authors-advanced-Django-Blog",
		"id": 162,
		"parentId": "3",
		"dateAddedLocal": "04/05/2022, 12:31:27",
		"dateAddedUTC": "2022-05-04T07:01:27.647Z"
	},
	{
		"index": 43,
		"title": "Startup | Bootstrap 5 Startup Template",
		"url": "https://demo.ayroui.com/templates/startup-template/",
		"id": 163,
		"parentId": "3",
		"dateAddedLocal": "10/05/2022, 03:09:44",
		"dateAddedUTC": "2022-05-09T21:39:44.444Z"
	},
	{
		"index": 44,
		"title": "How we use Python at Spotify : Spotify Engineering",
		"url": "https://engineering.atspotify.com/2013/03/how-we-use-python-at-spotify/",
		"id": 164,
		"parentId": "3",
		"dateAddedLocal": "12/05/2022, 12:10:12",
		"dateAddedUTC": "2022-05-12T06:40:12.016Z"
	},
	{
		"index": 45,
		"title": "codeartisanlab/ecommerce-website-in-django-3-and-bootstrap-4",
		"url": "https://github.com/codeartisanlab/ecommerce-website-in-django-3-and-bootstrap-4",
		"id": 165,
		"parentId": "3",
		"dateAddedLocal": "12/05/2022, 15:47:53",
		"dateAddedUTC": "2022-05-12T10:17:53.484Z"
	},
	{
		"index": 46,
		"title": "Alpine.js",
		"url": "https://alpinejs.dev/",
		"id": 166,
		"parentId": "3",
		"dateAddedLocal": "19/05/2022, 15:56:32",
		"dateAddedUTC": "2022-05-19T10:26:32.316Z"
	},
	{
		"index": 47,
		"title": "Mean value for Screens by KaviHarjani · Pull Request #538 · Mittal-Analytics/screener",
		"url": "https://github.com/Mittal-Analytics/screener/pull/538/files",
		"id": 167,
		"parentId": "3",
		"dateAddedLocal": "21/05/2022, 14:48:22",
		"dateAddedUTC": "2022-05-21T09:18:22.632Z"
	},
	{
		"index": 48,
		"title": "Building an Autocomplete/Typeahead Component with AlpineJS and Livewire | Chris Di Carlo",
		"url": "https://chrisdicarlo.ca/blog/",
		"id": 168,
		"parentId": "3",
		"dateAddedLocal": "25/05/2022, 16:30:58",
		"dateAddedUTC": "2022-05-25T11:00:58.325Z"
	},
	{
		"index": 49,
		"title": "Alpine Js Autocomplete Example Tutorial - MyWebtuts.com",
		"url": "https://www.mywebtuts.com/blog/alpine-js-autocomplete-example-tutorial",
		"id": 169,
		"parentId": "3",
		"dateAddedLocal": "25/05/2022, 17:56:00",
		"dateAddedUTC": "2022-05-25T12:26:00.966Z"
	},
	{
		"index": 50,
		"title": "AutoComplete-Input-Elastic-Search-Python/Frontend at masten",
		"url": "https://github.com/soumilshah1995/AutoComplete-Input-Elastic-Search-Python/tree/master/Frontend",
		"id": 170,
		"parentId": "3",
		"dateAddedLocal": "26/05/2022, 11:59:27",
		"dateAddedUTC": "2022-05-26T06:29:27.114Z"
	},
	{
		"index": 51,
		"title": "https://www.reddit.com/gallery/t1rwq8",
		"url": "https://www.reddit.com/gallery/t1rwq8",
		"id": 171,
		"parentId": "3",
		"dateAddedLocal": "26/05/2022, 15:41:50",
		"dateAddedUTC": "2022-05-26T10:11:50.109Z"
	},
	{
		"index": 52,
		"title": "tips-and-tricks/navigation.blade.php at master · Laratipsofficial/tips-and-tricks",
		"url": "https://github.com/Laratipsofficial/tips-and-tricks/blob/master/resources/views/layouts/navigation.blade.php",
		"id": 172,
		"parentId": "3",
		"dateAddedLocal": "26/05/2022, 16:41:13",
		"dateAddedUTC": "2022-05-26T11:11:13.859Z"
	},
	{
		"index": 53,
		"title": "Product -School Managment",
		"url": "https://school.finazer.com/Home/Product",
		"id": 173,
		"parentId": "3",
		"dateAddedLocal": "27/05/2022, 14:42:55",
		"dateAddedUTC": "2022-05-27T09:12:55.469Z"
	},
	{
		"index": 54,
		"title": "Feedbacks 20 Microns Ltd - Screener",
		"url": "http://127.0.0.1:8000/wiki/feedback/11/?Flag",
		"id": 174,
		"parentId": "3",
		"dateAddedLocal": "06/06/2022, 12:27:47",
		"dateAddedUTC": "2022-06-06T06:57:47.821Z"
	},
	{
		"index": 55,
		"title": "How to Implement Dependent/Chained Dropdown List with Django",
		"url": "https://simpleisbetterthancomplex.com/",
		"id": 175,
		"parentId": "3",
		"dateAddedLocal": "07/06/2022, 15:34:08",
		"dateAddedUTC": "2022-06-07T10:04:08.870Z"
	},
	{
		"index": 56,
		"title": "Distance Metrics | Different Distance Metrics In Machine Learning",
		"url": "https://www.analyticsvidhya.com/blog/2020/02/4-types-of-distance-metrics-in-machine-learning/",
		"id": 176,
		"parentId": "3",
		"dateAddedLocal": "09/06/2022, 15:20:26",
		"dateAddedUTC": "2022-06-09T09:50:26.834Z"
	},
	{
		"index": 57,
		"title": "MySQL :: MySQL 8.0 Reference Manual :: 13.2.6.2 INSERT ... ON DUPLICATE KEY UPDATE Statement",
		"url": "https://dev.mysql.com/doc/refman/8.0/en/insert-on-duplicate.html",
		"id": 177,
		"parentId": "3",
		"dateAddedLocal": "10/06/2022, 14:04:36",
		"dateAddedUTC": "2022-06-10T08:34:36.697Z"
	},
	{
		"index": 58,
		"title": "Python Tutorial: Fuzzy Name Matching Algorithms | by Felix Kuestahler | Towards Data Science",
		"url": "https://towardsdatascience.com/python-tutorial-fuzzy-name-matching-algorithms-7a6f43322cc5",
		"id": 178,
		"parentId": "3",
		"dateAddedLocal": "14/06/2022, 13:45:48",
		"dateAddedUTC": "2022-06-14T08:15:48.545Z"
	},
	{
		"index": 59,
		"title": "String similarity — the basic know your algorithms guide! | by Mohit Mayank | ITNEXT",
		"url": "https://itnext.io/string-similarity-the-basic-know-your-algorithms-guide-3de3d7346227",
		"id": 179,
		"parentId": "3",
		"dateAddedLocal": "15/06/2022, 17:02:11",
		"dateAddedUTC": "2022-06-15T11:32:11.835Z"
	},
	{
		"index": 60,
		"title": "Surprisingly Effective Way To Name Matching In Python | by Mala Deep | Towards Data Science",
		"url": "https://towardsdatascience.com/surprisingly-effective-way-to-name-matching-in-python-1a67328e670e",
		"id": 180,
		"parentId": "3",
		"dateAddedLocal": "16/06/2022, 11:38:29",
		"dateAddedUTC": "2022-06-16T06:08:29.157Z"
	},
	{
		"index": 61,
		"title": "GitHub Profile Readme Generator | GitHub Profile Readme Generator",
		"url": "https://rahuldkjain.github.io/gh-profile-readme-generator/",
		"id": 181,
		"parentId": "3",
		"dateAddedLocal": "16/06/2022, 12:32:09",
		"dateAddedUTC": "2022-06-16T07:02:09.796Z"
	},
	{
		"index": 62,
		"title": "The cascade",
		"url": "https://web.dev/learn/css/the-cascade/",
		"id": 182,
		"parentId": "3",
		"dateAddedLocal": "16/06/2022, 14:02:24",
		"dateAddedUTC": "2022-06-16T08:32:24.900Z"
	},
	{
		"index": 63,
		"title": "School Management Software, School - College ERP - Genius Education Management System",
		"url": "https://www.geniusedusoft.com/",
		"id": 183,
		"parentId": "3",
		"dateAddedLocal": "18/06/2022, 11:57:21",
		"dateAddedUTC": "2022-06-18T06:27:21.412Z"
	},
	{
		"index": 64,
		"title": "Real World Example on Web Scraping with Selenium and Beautiful Soup | by Timothy Tan | Towards Data Science",
		"url": "https://towardsdatascience.com/real-world-example-on-web-scraping-with-selenium-and-beautiful-soup-3e615dbc1fa1",
		"id": 184,
		"parentId": "3",
		"dateAddedLocal": "20/06/2022, 09:44:32",
		"dateAddedUTC": "2022-06-20T04:14:32.779Z"
	},
	{
		"index": 65,
		"title": "data-science-utils/Web Scraping and Financial Data Exploration",
		"url": "https://github.com/faizanahemad/data-science-utils/",
		"id": 185,
		"parentId": "3",
		"dateAddedLocal": "20/06/2022, 09:48:27",
		"dateAddedUTC": "2022-06-20T04:18:27.006Z"
	},
	{
		"index": 66,
		"title": "beautifulsoup - Downloading csv file from bseindia using python - Stack Overflow",
		"url": "https://stackoverflow.com/questions/63078354/downloading-csv-file-from-bseindia-using-python",
		"id": 186,
		"parentId": "3",
		"dateAddedLocal": "20/06/2022, 10:29:53",
		"dateAddedUTC": "2022-06-20T04:59:53.562Z"
	},
	{
		"index": 67,
		"title": "NseDataCollection/nse_data_collection.py at master · RajuGujjalapati/NseDataCollection",
		"url": "https://github.com/RajuGujjalapati/NseDataCollection/blob/master/nse_data_collection.py",
		"id": 187,
		"parentId": "3",
		"dateAddedLocal": "20/06/2022, 10:30:59",
		"dateAddedUTC": "2022-06-20T05:00:59.225Z"
	},
	{
		"index": 68,
		"title": "How to Create a Python Script to Automatically Monitor Prices Online | Better Programming",
		"url": "https://betterprogramming.pub/how-to-create-a-python-script-to-automatically-monitor-prices-online-e7addd12548",
		"id": 188,
		"parentId": "3",
		"dateAddedLocal": "21/06/2022, 09:26:00",
		"dateAddedUTC": "2022-06-21T03:56:00.883Z"
	},
	{
		"index": 69,
		"title": "How to download HTML element as a image. Visiting card designer - DEV Community 👩‍💻👨‍💻",
		"url": "https://dev.to/kunaal438/how-to-make-a-designing-website-with-html-css-and-js-visiting-card-designer-4ml4",
		"id": 189,
		"parentId": "3",
		"dateAddedLocal": "22/06/2022, 00:45:33",
		"dateAddedUTC": "2022-06-21T19:15:33.496Z"
	},
	{
		"index": 70,
		"title": "Building a CRUD App with FastAPI, MongoDB, and Beanie | TestDriven.io",
		"url": "https://testdriven.io/blog/fastapi-beanie/",
		"id": 190,
		"parentId": "3",
		"dateAddedLocal": "22/06/2022, 13:36:26",
		"dateAddedUTC": "2022-06-22T08:06:26.221Z"
	},
	{
		"index": 71,
		"title": "Building a CRUD App with FastAPI, MongoDB, and Beanie | TestDriven.io",
		"url": "https://testdriven.io/blog/fastapi-beanie/#initial-setup",
		"id": 191,
		"parentId": "3",
		"dateAddedLocal": "22/06/2022, 13:58:38",
		"dateAddedUTC": "2022-06-22T08:28:38.410Z"
	},
	{
		"index": 72,
		"title": "Downloading... | CodyHouse",
		"url": "https://codyhouse.co/redirect-experiment",
		"id": 192,
		"parentId": "3",
		"dateAddedLocal": "27/06/2022, 16:55:16",
		"dateAddedUTC": "2022-06-27T11:25:16.847Z"
	},
	{
		"index": 73,
		"title": "How to Use Vim for Beginners. No, I am not talking about dish-wash… | by Anand Parmar | SelectFrom",
		"url": "https://selectfrom.dev/how-to-use-vim-bf92438a8eca",
		"id": 193,
		"parentId": "3",
		"dateAddedLocal": "01/07/2022, 17:23:44",
		"dateAddedUTC": "2022-07-01T11:53:44.296Z"
	},
	{
		"index": 74,
		"title": "Understanding Layout Algorithms",
		"url": "https://www.joshwcomeau.com/css/understanding-layout-algorithms/",
		"id": 194,
		"parentId": "3",
		"dateAddedLocal": "02/07/2022, 16:30:26",
		"dateAddedUTC": "2022-07-02T11:00:26.145Z"
	},
	{
		"index": 75,
		"title": "DevAssets - Curated List of Resources for Developers",
		"url": "https://xsgames.co/devassets/?ref=producthunt",
		"id": 195,
		"parentId": "3",
		"dateAddedLocal": "05/07/2022, 17:04:17",
		"dateAddedUTC": "2022-07-05T11:34:17.346Z"
	},
	{
		"index": 76,
		"title": "mtdvio/every-programmer-should-know",
		"url": "https://github.com/mtdvio/every-programmer-should-know",
		"id": 196,
		"parentId": "3",
		"dateAddedLocal": "07/07/2022, 09:51:43",
		"dateAddedUTC": "2022-07-07T04:21:43.085Z"
	},
	{
		"index": 77,
		"title": "Defensive CSS - Input zoom on iOS Safari",
		"url": "https://defensivecss.dev/tip/input-zoom-safari/",
		"id": 197,
		"parentId": "3",
		"dateAddedLocal": "07/07/2022, 14:40:00",
		"dateAddedUTC": "2022-07-07T09:10:00.199Z"
	},
	{
		"index": 78,
		"title": "Iteration Jul 20 - Jul 27 | Iterations | Shortcut",
		"url": "https://app.shortcut.com/python-django/iteration/17/Iteration%20Jul%2020%20-%20Jul%2027?from=signup&groupBy=workflowState&cf_workflow=500000005&ct_workflow=all",
		"id": 198,
		"parentId": "3",
		"dateAddedLocal": "13/07/2022, 13:29:00",
		"dateAddedUTC": "2022-07-13T07:59:00.212Z"
	},
	{
		"index": 79,
		"title": "Extend your application · HonKit",
		"url": "https://tutorial.djangogirls.org/en/extend_your_application/",
		"id": 199,
		"parentId": "3",
		"dateAddedLocal": "15/07/2022, 16:22:56",
		"dateAddedUTC": "2022-07-15T10:52:56.678Z"
	},
	{
		"index": 80,
		"title": "Third party apps — Building Multi Tenant Applications with Django 2.0 documentation",
		"url": "https://books.agiliq.com/projects/django-multi-tenant/en/latest/third-party-apps.html#a-tour-of-django-tenant-schemas",
		"id": 200,
		"parentId": "3",
		"dateAddedLocal": "15/07/2022, 16:38:44",
		"dateAddedUTC": "2022-07-15T11:08:44.090Z"
	},
	{
		"index": 81,
		"title": "Build a Mobile Application With the Kivy Python Framework – Real Python",
		"url": "https://realpython.com/mobile-app-kivy-python/",
		"id": 201,
		"parentId": "3",
		"dateAddedLocal": "27/07/2022, 16:29:06",
		"dateAddedUTC": "2022-07-27T10:59:06.237Z"
	},
	{
		"index": 82,
		"title": "A Guide to User Registration, Login, and Logout in Django",
		"url": "https://ordinarycoders.com/blog/article/django-user-register-login-logout",
		"id": 202,
		"parentId": "3",
		"dateAddedLocal": "28/07/2022, 16:53:43",
		"dateAddedUTC": "2022-07-28T11:23:43.006Z"
	},
	{
		"index": 83,
		"title": "Django Web Framework",
		"url": "https://ordinarycoders.com/blog/django",
		"id": 203,
		"parentId": "3",
		"dateAddedLocal": "28/07/2022, 17:01:07",
		"dateAddedUTC": "2022-07-28T11:31:07.279Z"
	},
	{
		"index": 84,
		"title": "Design Your Own Login and Registration System in Django | by Esther Vaati | Better Programming",
		"url": "https://betterprogramming.pub/design-your-own-login-and-registration-system-in-django-b34a2fa8334d",
		"id": 204,
		"parentId": "3",
		"dateAddedLocal": "28/07/2022, 17:14:18",
		"dateAddedUTC": "2022-07-28T11:44:18.339Z"
	},
	{
		"index": 85,
		"title": "25+ Useful Commands in Jupyter Notebook",
		"url": "https://ordinarycoders.com/blog/article/25-python-commands-jupyter-notebook",
		"id": 205,
		"parentId": "3",
		"dateAddedLocal": "01/08/2022, 16:47:55",
		"dateAddedUTC": "2022-08-01T11:17:55.065Z"
	},
	{
		"index": 86,
		"title": "CSS border animations",
		"url": "https://web.dev/css-border-animations/",
		"id": 206,
		"parentId": "3",
		"dateAddedLocal": "02/08/2022, 10:37:10",
		"dateAddedUTC": "2022-08-02T05:07:10.317Z"
	},
	{
		"index": 87,
		"title": "Latest",
		"url": "https://ltst.xyz/explore",
		"id": 207,
		"parentId": "3",
		"dateAddedLocal": "03/08/2022, 12:47:18",
		"dateAddedUTC": "2022-08-03T07:17:18.428Z"
	},
	{
		"index": 88,
		"title": "Create beautiful images of your code",
		"url": "https://ray.so/",
		"id": 208,
		"parentId": "3",
		"dateAddedLocal": "03/08/2022, 16:03:02",
		"dateAddedUTC": "2022-08-03T10:33:02.550Z"
	},
	{
		"index": 89,
		"title": "charmbracelet/gum: A tool for glamorous shell scripts 🎀",
		"url": "https://github.com/charmbracelet/gum",
		"id": 209,
		"parentId": "3",
		"dateAddedLocal": "03/08/2022, 16:54:04",
		"dateAddedUTC": "2022-08-03T11:24:04.752Z"
	},
	{
		"index": 90,
		"title": "TO-DOs List",
		"url": "https://www.get-things-done.com/u/upx-hyw-rap/",
		"id": 210,
		"parentId": "3",
		"dateAddedLocal": "05/08/2022, 16:48:19",
		"dateAddedUTC": "2022-08-05T11:18:19.517Z"
	},
	{
		"index": 91,
		"title": "Write Better Commits, Build Better Projects | The GitHub Blog",
		"url": "https://github.blog/2022-06-30-write-better-commits-build-better-projects/",
		"id": 211,
		"parentId": "3",
		"dateAddedLocal": "06/08/2022, 10:38:26",
		"dateAddedUTC": "2022-08-06T05:08:26.410Z"
	},
	{
		"index": 92,
		"title": "Complete Setup of Django Project In 13 Steps | Medium",
		"url": "https://medium.com/@umaraziz021/complete-step-up-of-django-project-in-13-simple-steps-17d394410c99",
		"id": 212,
		"parentId": "3",
		"dateAddedLocal": "06/08/2022, 16:47:36",
		"dateAddedUTC": "2022-08-06T11:17:36.587Z"
	},
	{
		"index": 93,
		"title": "DjangoTricks: Generic Functionality without Generic Relations",
		"url": "https://djangotricks.blogspot.com/2022/04/generic-functionality-without-generic-relations.html",
		"id": 213,
		"parentId": "3",
		"dateAddedLocal": "10/08/2022, 15:00:09",
		"dateAddedUTC": "2022-08-10T09:30:09.210Z"
	}
]